scene_id,act,title,voiceover_text,overlay,duration_sec,notes
0.1,LIST DEALS,Deal List,"The server seeds five sample deals on startup — spanning DOOH, audio, gaming, CTV, and retail inventory. Claude called the deals list tool and returned them all in IAB format with status codes, ad types, and CPM prices.",5 Pre-loaded Deals | deals_list,14,Deal list visible on screen
1.1,CREATE DEAL,Create Deal,"Now we create a deal using natural language. Claude calls deals create, which validates through a Zod schema — name, ad types, floor price, and start date are required. An IAB-compliant deal ID is generated and the status is set to Pending, ready for a provider.",Tool: deals_create → Zod Validation,17,Create prompt appears at ~15s
2.1,SEND TO PROVIDER,Send to DSP,"We send the deal to a DSP partner. Claude first calls providers list to discover available partners, finds the Mock Provider, then calls deals send. This provider abstraction layer means swapping in The Trade Desk or DV360 requires zero changes to the tool logic. The deal now has a platform deal ID and awaits buyer approval.",Tool: deals_send → Provider Abstraction,22,Send prompt at ~35s through result at ~55s
3.1,CHECK STATUS,Status Check,"Checking status reveals the dual-status model — seller is Active, buyer is Pending. This IAB pattern tracks both sides of every deal independently across all connected providers.",Dual Status: Seller=Active Buyer=Pending,11,Status check at ~60s
4.1,CONFIRM DEAL,Confirm & Activate,"Deals confirm marks all buyer seats as Accepted and activates the deal. The buyer seat, provider, acceptance date, and go-live date are all recorded.",Tool: deals_confirm → ACCEPTED,10,Confirm at ~75s
5.1,PAUSE RESUME,Pause & Resume,"Deals pause changes the status and notifies every connected provider automatically. The reason is captured in the audit trail — essential for compliance. One tool call propagates across all platforms.",Tool: deals_pause → Audit Trail,12,Pause at ~90s
6.1,CLOSING,Closing,"And resume restores the deal to Active across all providers. That's the complete lifecycle — nine MCP tools, IAB-compliant data models, and an extensible provider architecture. This open-source reference implementation is from the IAB Tech Lab Agentic Task Force. Thank you.",9 MCP Tools • IAB Compliant • Open Source,17,Resume at ~105s through end
